771,18-24,Male,Rural,Mandarin,Master,7428,47,Tablet,1.8,7.3,0.085,0.032,75,0-20k,"Software Engineering, Data Science"
772,55-64,Male,Rural,Hindi,Technical,4733,462,Desktop Only,4.5,7.8,0.195,0.072,16,80k-100k,"Pet Care, Photography, Gaming"
773,18-24,Male,Rural,Mandarin,PhD,3292,480,Mobile Only,1.2,7.9,0.144,0.028,133,80k-100k,"Travel and Adventure, Software Engineering, Gardening"
774,25-34,Female,Rural,Hindi,Technical,400,485,Mobile Only,3.7,6.5,0.246,0.075,120,60k-80k,"Gourmet Cooking, Pet Care"
775,45-54,Male,Suburban,Mandarin,High School,823,235,Tablet,4.9,5.6,0.062,0.003,157,80k-100k,"Gourmet Cooking, Investing and Finance"
776,18-24,Male,Suburban,English,Master,5794,62,Mobile Only,4.1,3.4,0.02,0.028,137,40k-60k,"Digital Marketing, Fashion Modelling"
777,25-34,Female,Suburban,Spanish,High School,3110,408,Desktop Only,1.6,2.2,0.017,0.05,87,100k+,"Digital Marketing, Photography, Music Production"
778,45-54,Male,Suburban,English,High School,5655,233,Mobile Only,4.6,1.6,0.16,0.005,10,0-20k,"Reading and Literature, Software Engineering"
779,45-54,Female,Urban,Mandarin,Bachelor,167,163,Mobile + Desktop,0.9,5.9,0.235,0.019,30,80k-100k,"Gardening, Reading and Literature"
780,45-54,Female,Suburban,Mandarin,Master,2606,57,Mobile + Desktop,2.6,6.5,0.0,0.093,117,20k-40k,"Fashion Modelling, Reading and Literature, Gourmet Cooking"
781,45-54,Male,Rural,Mandarin,High School,1637,360,Desktop Only,4.5,6.8,0.181,0.098,107,0-20k,"Digital Marketing, Reading and Literature"
782,35-44,Male,Rural,Hindi,PhD,497,156,Mobile + Desktop,3.4,7.4,0.164,0.074,124,0-20k,"Fitness and Wellness, Gourmet Cooking, Eco-Friendly Living"
783,25-34,Male,Suburban,Spanish,High School,5780,402,Tablet,2.4,7.2,0.183,0.025,171,40k-60k,"Software Engineering, Investing and Finance, Gourmet Cooking, Fitness and Wellness"
784,25-34,Male,Rural,Spanish,PhD,9455,73,Mobile Only,1.8,8.0,0.089,0.026,13,100k+,"Fashion Modelling, DIY Crafts"
785,25-34,Male,Suburban,Mandarin,Bachelor,4925,358,Desktop Only,2.2,2.7,0.205,0.065,49,0-20k,"Gardening, Fitness and Wellness, Gourmet Cooking, Investing and Finance"
786,55-64,Female,Rural,Mandarin,High School,8847,191,Tablet,2.8,6.3,0.011,0.012,18,0-20k,"Software Engineering, Fashion Modelling, Pet Care, Data Science"
787,35-44,Female,Urban,Hindi,Technical,6148,134,Mobile Only,1.9,5.1,0.189,0.095,116,40k-60k,"Digital Marketing, Photography, Gourmet Cooking, DIY Crafts"
788,35-44,Female,Urban,English,Bachelor,3761,188,Tablet,4.9,2.8,0.067,0.022,59,100k+,"Digital Marketing, Fashion Modelling, Gardening, Software Engineering"
789,35-44,Female,Suburban,English,PhD,3041,48,Desktop Only,4.7,7.9,0.119,0.1,141,100k+,"Travel and Adventure, Gourmet Cooking, Gardening"
790,55-64,Male,Suburban,Spanish,Bachelor,7167,269,Desktop Only,4.4,7.3,0.206,0.05,19,60k-80k,"Investing and Finance, Reading and Literature, Music Production"
791,25-34,Female,Suburban,Hindi,High School,5191,391,Tablet,2.4,1.9,0.068,0.077,41,60k-80k,"Photography, Data Science"
792,35-44,Male,Rural,Mandarin,Master,1701,12,Mobile Only,3.6,1.2,0.046,0.0,131,100k+,"Fashion Modelling, Music Production"
793,35-44,Male,Suburban,Spanish,Master,1580,73,Mobile + Desktop,4.6,5.8,0.17,0.089,121,60k-80k,"Fashion Modelling, Investing and Finance, Music Production"
794,45-54,Male,Urban,Hindi,PhD,6330,38,Mobile + Desktop,4.3,5.2,0.133,0.027,88,100k+,"Eco-Friendly Living, Fashion Modelling"
795,18-24,Female,Rural,English,PhD,9394,381,Tablet,2.4,7.6,0.129,0.067,76,100k+,Photography
796,55-64,Female,Suburban,Hindi,Master,3376,20,Desktop Only,1.0,2.6,0.064,0.081,100,20k-40k,"Pet Care, Gourmet Cooking, Fashion Modelling"
797,55-64,Male,Rural,English,PhD,6547,106,Mobile Only,0.8,1.6,0.009,0.016,115,0-20k,"Fitness and Wellness, DIY Crafts, Investing and Finance"
798,35-44,Female,Rural,Hindi,Bachelor,5599,367,Mobile Only,3.1,2.8,0.103,0.044,153,80k-100k,"Travel and Adventure, Music Production, Photography, Gourmet Cooking"
799,45-54,Female,Suburban,Spanish,Technical,6373,451,Desktop Only,3.4,1.1,0.027,0.049,109,80k-100k,"Photography, Digital Marketing, Music Production, DIY Crafts"
800,55-64,Female,Rural,English,Technical,1399,212,Mobile + Desktop,4.3,1.3,0.226,0.031,151,80k-100k,Pet Care
801,45-54,Male,Urban,Spanish,Bachelor,5918,420,Mobile Only,1.8,7.4,0.01,0.048,62,100k+,Investing and Finance
802,25-34,Female,Urban,Spanish,Technical,6801,490,Tablet,1.3,3.5,0.108,0.032,99,100k+,"Music Production, Digital Marketing"
803,35-44,Female,Rural,English,High School,5094,30,Mobile + Desktop,2.2,3.9,0.013,0.036,122,80k-100k,"Investing and Finance, Photography, Music Production"
804,45-54,Female,Suburban,English,Bachelor,7589,48,Tablet,2.1,1.1,0.024,0.067,10,40k-60k,"Gourmet Cooking, Pet Care, Fashion Modelling"
805,35-44,Male,Rural,Mandarin,PhD,9827,232,Mobile + Desktop,1.1,2.9,0.165,0.063,8,80k-100k,"Data Science, Digital Marketing, Pet Care, DIY Crafts"
806,45-54,Female,Urban,Mandarin,Bachelor,8369,111,Desktop Only,3.5,6.6,0.162,0.023,47,40k-60k,"Photography, Software Engineering"
807,55-64,Female,Rural,Mandarin,Master,2931,55,Tablet,2.8,5.3,0.008,0.09,97,60k-80k,"Fitness and Wellness, Data Science"
808,55-64,Male,Rural,Spanish,PhD,2821,75,Tablet,3.7,6.3,0.0,0.086,46,100k+,"Fitness and Wellness, Travel and Adventure, Gaming"
809,35-44,Male,Urban,Spanish,Master,1632,100,Desktop Only,2.1,4.1,0.02,0.051,7,80k-100k,"DIY Crafts, Fitness and Wellness"
810,18-24,Female,Rural,Mandarin,PhD,8529,173,Tablet,2.0,3.2,0.191,0.043,133,60k-80k,"DIY Crafts, Gardening"
811,65+,Male,Rural,Spanish,Technical,5353,468,Mobile + Desktop,2.6,4.4,0.146,0.038,19,60k-80k,"Gourmet Cooking, Music Production, Investing and Finance"
812,55-64,Female,Suburban,Spanish,Bachelor,2096,120,Mobile Only,4.4,3.3,0.01,0.071,51,80k-100k,Eco-Friendly Living
813,18-24,Female,Suburban,English,High School,5411,347,Mobile Only,0.7,6.9,0.122,0.067,89,80k-100k,"Data Science, Reading and Literature"
814,55-64,Female,Urban,English,PhD,377,132,Desktop Only,4.1,3.1,0.178,0.02,178,60k-80k,"Travel and Adventure, Reading and Literature"
815,55-64,Female,Urban,Spanish,PhD,3189,202,Mobile + Desktop,2.2,5.6,0.217,0.067,62,60k-80k,"Pet Care, Eco-Friendly Living, DIY Crafts, Digital Marketing"
816,35-44,Female,Urban,Mandarin,Master,623,456,Tablet,4.3,2.0,0.234,0.025,43,40k-60k,"Fitness and Wellness, Gaming, DIY Crafts"
817,35-44,Male,Suburban,Hindi,Technical,4375,108,Tablet,4.1,5.8,0.082,0.002,135,20k-40k,"Music Production, Reading and Literature, Fitness and Wellness"
818,25-34,Male,Urban,Mandarin,Master,5465,300,Mobile Only,2.1,7.4,0.034,0.07,162,60k-80k,Digital Marketing
819,18-24,Female,Urban,Hindi,Master,3222,168,Tablet,3.6,5.3,0.059,0.064,39,20k-40k,"Gaming, Software Engineering, Gardening"
820,25-34,Female,Urban,Mandarin,Technical,8267,421,Mobile Only,1.2,4.9,0.194,0.041,161,100k+,Fashion Modelling
821,55-64,Male,Suburban,English,High School,5290,112,Desktop Only,4.5,7.7,0.243,0.053,56,100k+,Travel and Adventure
822,18-24,Male,Rural,Spanish,Master,4675,394,Tablet,2.3,5.4,0.117,0.095,122,60k-80k,"Gaming, Eco-Friendly Living, DIY Crafts, Pet Care"
823,25-34,Female,Urban,Spanish,Master,7827,290,Mobile + Desktop,2.6,2.8,0.076,0.06,18,100k+,Software Engineering
824,25-34,Female,Rural,English,PhD,1897,52,Tablet,3.7,3.0,0.107,0.066,167,80k-100k,Investing and Finance
825,35-44,Female,Urban,Hindi,Technical,2231,495,Mobile Only,4.2,5.9,0.076,0.006,160,80k-100k,Photography
826,55-64,Female,Rural,Hindi,Bachelor,7422,93,Desktop Only,1.6,6.1,0.064,0.017,34,80k-100k,Data Science
827,25-34,Female,Suburban,Hindi,High School,6600,460,Mobile Only,3.5,3.1,0.148,0.03,94,0-20k,"Digital Marketing, Fitness and Wellness, Software Engineering, Investing and Finance"
828,25-34,Female,Suburban,English,High School,915,200,Tablet,2.3,3.4,0.004,0.054,139,0-20k,"Reading and Literature, Investing and Finance"
829,45-54,Female,Urban,Hindi,Technical,8734,60,Mobile Only,2.2,7.9,0.065,0.078,171,60k-80k,Gourmet Cooking
830,35-44,Female,Rural,English,PhD,6766,395,Mobile Only,3.6,1.7,0.165,0.032,99,40k-60k,"Investing and Finance, Gaming, Data Science"
831,25-34,Female,Suburban,Mandarin,PhD,242,219,Desktop Only,2.2,3.8,0.008,0.036,73,60k-80k,"Fitness and Wellness, Gardening"
832,35-44,Male,Urban,Mandarin,Technical,1510,135,Mobile + Desktop,2.1,1.4,0.021,0.026,167,100k+,"Pet Care, Software Engineering, Travel and Adventure, Data Science"
833,18-24,Male,Urban,English,PhD,634,457,Tablet,4.3,6.7,0.073,0.025,131,100k+,"Data Science, Eco-Friendly Living, Pet Care"
834,25-34,Female,Suburban,Spanish,High School,3464,467,Desktop Only,1.0,1.6,0.219,0.095,56,0-20k,"Gourmet Cooking, Music Production, Travel and Adventure"
835,35-44,Female,Suburban,Mandarin,High School,1132,78,Mobile + Desktop,3.5,5.7,0.191,0.064,146,0-20k,"DIY Crafts, Photography, Investing and Finance"
836,35-44,Female,Urban,Hindi,Bachelor,3442,274,Mobile Only,1.6,1.4,0.006,0.016,67,60k-80k,"DIY Crafts, Digital Marketing, Gardening"
837,55-64,Male,Rural,English,Technical,9702,267,Mobile + Desktop,0.6,5.7,0.125,0.072,40,0-20k,"Gardening, Travel and Adventure, Eco-Friendly Living"
838,25-34,Female,Rural,Hindi,Master,6185,427,Mobile Only,1.3,6.9,0.069,0.072,95,0-20k,Investing and Finance
839,35-44,Female,Rural,Hindi,Master,4600,197,Mobile Only,3.2,3.8,0.162,0.067,156,20k-40k,"Digital Marketing, Gourmet Cooking"
840,45-54,Male,Urban,Spanish,Bachelor,1272,239,Desktop Only,3.7,4.7,0.18,0.013,172,20k-40k,"Software Engineering, Data Science, Gourmet Cooking"
841,18-24,Male,Suburban,Hindi,Bachelor,9180,198,Mobile Only,0.6,3.8,0.216,0.041,161,20k-40k,"Gaming, Travel and Adventure"
842,45-54,Female,Urban,Spanish,PhD,4617,424,Desktop Only,0.7,3.1,0.119,0.011,57,40k-60k,"Pet Care, Data Science, Gourmet Cooking"
843,25-34,Male,Suburban,Mandarin,Bachelor,8107,19,Mobile + Desktop,4.6,6.6,0.249,0.082,113,60k-80k,"Fashion Modelling, Gardening"
844,65+,Female,Rural,English,Bachelor,1741,123,Mobile + Desktop,0.8,2.9,0.245,0.066,154,0-20k,"Data Science, Gaming, Fitness and Wellness"
845,18-24,Female,Rural,Hindi,Master,571,85,Mobile Only,4.5,6.1,0.221,0.051,76,40k-60k,"Data Science, Fitness and Wellness, Fashion Modelling, Investing and Finance"
846,35-44,Female,Suburban,English,PhD,3040,173,Desktop Only,1.5,2.4,0.144,0.034,19,80k-100k,Gardening
847,18-24,Male,Suburban,Hindi,Bachelor,8838,94,Mobile Only,3.8,2.7,0.1,0.018,117,0-20k,"Investing and Finance, Photography"
848,65+,Male,Urban,English,Bachelor,4826,58,Desktop Only,1.9,3.4,0.091,0.011,73,100k+,"Travel and Adventure, Eco-Friendly Living, Digital Marketing, Data Science"
849,35-44,Male,Rural,Hindi,PhD,7770,335,Desktop Only,4.4,5.1,0.003,0.097,120,40k-60k,Travel and Adventure
850,35-44,Male,Urban,Hindi,Technical,3823,186,Desktop Only,3.7,4.2,0.062,0.02,8,40k-60k,"DIY Crafts, Travel and Adventure, Software Engineering"
851,18-24,Male,Urban,Hindi,PhD,463,396,Mobile + Desktop,2.3,6.2,0.18,0.006,79,100k+,"Reading and Literature, Fashion Modelling, Photography"
852,45-54,Female,Urban,Hindi,Master,3409,467,Desktop Only,0.8,2.5,0.151,0.096,150,60k-80k,"Reading and Literature, Software Engineering, Music Production"
853,25-34,Male,Rural,Hindi,Technical,645,398,Mobile + Desktop,3.8,1.1,0.229,0.055,46,20k-40k,"Music Production, Software Engineering"
854,55-64,Male,Urban,Hindi,High School,3340,227,Desktop Only,3.3,6.4,0.013,0.08,34,100k+,"Gardening, Fitness and Wellness, Photography"
855,25-34,Female,Urban,Hindi,PhD,6765,198,Mobile + Desktop,0.5,6.8,0.039,0.004,147,0-20k,"DIY Crafts, Eco-Friendly Living"
856,25-34,Male,Urban,Hindi,Master,2036,478,Tablet,0.5,1.4,0.197,0.057,74,80k-100k,"Gaming, Software Engineering"
857,18-24,Male,Urban,Hindi,Technical,9254,355,Mobile + Desktop,4.1,5.3,0.09,0.04,20,60k-80k,"Reading and Literature, Travel and Adventure, Fitness and Wellness"
858,35-44,Male,Urban,English,PhD,982,239,Mobile + Desktop,1.7,3.6,0.03,0.077,115,80k-100k,"Data Science, Eco-Friendly Living, Reading and Literature, DIY Crafts"
859,35-44,Female,Urban,Spanish,Bachelor,3940,264,Mobile Only,3.4,6.6,0.249,0.004,108,80k-100k,"Reading and Literature, Gourmet Cooking, DIY Crafts"
860,18-24,Female,Rural,Hindi,PhD,7023,245,Desktop Only,2.5,7.1,0.197,0.04,111,20k-40k,"Digital Marketing, Gourmet Cooking"
861,45-54,Male,Urban,Spanish,High School,9162,35,Tablet,4.4,7.0,0.102,0.08,127,40k-60k,Gaming
862,35-44,Male,Suburban,Hindi,PhD,4711,81,Mobile Only,4.6,6.4,0.206,0.052,166,20k-40k,"DIY Crafts, Gardening, Fitness and Wellness, Reading and Literature"
863,35-44,Male,Urban,Hindi,Technical,9157,270,Desktop Only,5.0,2.9,0.17,0.055,31,40k-60k,Reading and Literature
864,35-44,Male,Urban,English,Technical,5304,263,Tablet,1.2,6.7,0.197,0.01,17,0-20k,"Investing and Finance, Digital Marketing"
865,35-44,Female,Rural,Mandarin,PhD,7388,280,Tablet,4.4,4.7,0.204,0.013,159,80k-100k,"Gaming, Travel and Adventure, Reading and Literature"
866,35-44,Male,Rural,Mandarin,Technical,3303,132,Tablet,1.7,1.4,0.021,0.068,77,20k-40k,"DIY Crafts, Fitness and Wellness, Fashion Modelling, Investing and Finance"
867,25-34,Female,Suburban,English,Bachelor,2344,153,Desktop Only,3.2,4.2,0.156,0.068,90,40k-60k,Investing and Finance
868,25-34,Male,Suburban,Spanish,PhD,118,266,Tablet,2.8,7.6,0.002,0.098,35,40k-60k,"Software Engineering, Reading and Literature, Investing and Finance, Photography"
869,55-64,Male,Rural,Mandarin,Bachelor,741,153,Tablet,0.6,7.2,0.011,0.071,7,80k-100k,"Fashion Modelling, Data Science, Music Production"
870,55-64,Female,Rural,English,Bachelor,3183,430,Mobile Only,4.7,1.7,0.226,0.049,34,60k-80k,"Investing and Finance, Photography, Travel and Adventure"
871,25-34,Male,Urban,English,Master,5300,268,Mobile + Desktop,0.9,6.2,0.132,0.086,153,0-20k,"Music Production, Eco-Friendly Living"
872,25-34,Female,Rural,Mandarin,PhD,8621,445,Desktop Only,3.6,6.6,0.184,0.01,103,80k-100k,"Travel and Adventure, Music Production, Eco-Friendly Living"
873,45-54,Female,Suburban,Spanish,Technical,965,56,Mobile + Desktop,4.0,2.9,0.21,0.045,138,60k-80k,"Gourmet Cooking, Investing and Finance, Fashion Modelling, Reading and Literature"
874,35-44,Male,Urban,English,Bachelor,873,360,Mobile Only,4.1,4.3,0.237,0.029,164,60k-80k,"Digital Marketing, Fashion Modelling, Reading and Literature"
875,18-24,Female,Suburban,Hindi,Master,4832,22,Mobile + Desktop,1.1,6.0,0.217,0.01,174,0-20k,"Data Science, Travel and Adventure, Reading and Literature, Investing and Finance"
876,25-34,Male,Urban,Spanish,PhD,3618,385,Tablet,2.5,4.1,0.121,0.076,164,20k-40k,"Investing and Finance, Eco-Friendly Living, Photography, Gaming"
877,45-54,Male,Rural,Spanish,PhD,6895,217,Tablet,4.2,1.8,0.084,0.051,103,80k-100k,Travel and Adventure
878,45-54,Male,Suburban,Mandarin,High School,7084,320,Desktop Only,1.9,5.9,0.039,0.056,90,60k-80k,"Fashion Modelling, Fitness and Wellness, Software Engineering, Photography"
879,18-24,Female,Urban,Mandarin,High School,2667,244,Desktop Only,2.6,7.4,0.1,0.041,171,20k-40k,"Music Production, Eco-Friendly Living, Digital Marketing"
880,25-34,Female,Urban,Hindi,Bachelor,1774,158,Desktop Only,1.7,5.6,0.092,0.046,68,80k-100k,"Gourmet Cooking, Fashion Modelling, Eco-Friendly Living, Investing and Finance"
881,25-34,Female,Rural,English,High School,839,331,Mobile Only,2.6,6.4,0.14,0.012,122,40k-60k,"Fashion Modelling, Travel and Adventure, Gardening, Data Science"
882,45-54,Female,Rural,Mandarin,Bachelor,1645,447,Desktop Only,4.5,3.5,0.166,0.067,162,40k-60k,Reading and Literature
883,18-24,Female,Rural,Mandarin,Technical,9427,164,Mobile Only,2.5,2.3,0.245,0.043,118,100k+,"Software Engineering, Eco-Friendly Living, Investing and Finance"
884,18-24,Female,Suburban,Spanish,Bachelor,5227,175,Tablet,3.0,5.5,0.182,0.082,163,100k+,Fitness and Wellness
885,45-54,Male,Urban,Mandarin,High School,7047,99,Mobile + Desktop,2.3,3.3,0.161,0.02,91,20k-40k,"Eco-Friendly Living, Fitness and Wellness, Gaming, Music Production"
886,25-34,Female,Rural,Mandarin,Technical,6720,195,Tablet,2.6,7.0,0.084,0.021,44,60k-80k,"Reading and Literature, Music Production"
887,45-54,Male,Suburban,Mandarin,High School,9165,327,Tablet,0.6,1.9,0.009,0.065,165,60k-80k,"Eco-Friendly Living, Gaming, Reading and Literature, Digital Marketing"
888,25-34,Female,Suburban,Mandarin,Bachelor,4655,367,Tablet,1.8,4.0,0.072,0.085,29,40k-60k,"DIY Crafts, Fashion Modelling"
889,18-24,Female,Suburban,Spanish,Master,5745,183,Desktop Only,2.5,3.8,0.192,0.047,168,100k+,"Travel and Adventure, Fashion Modelling, Music Production"
890,25-34,Male,Rural,Hindi,PhD,9043,226,Desktop Only,3.4,7.6,0.051,0.073,156,20k-40k,Travel and Adventure
891,45-54,Male,Rural,Hindi,High School,7224,404,Desktop Only,2.5,2.1,0.178,0.1,99,60k-80k,"Data Science, Reading and Literature, Pet Care"
892,55-64,Female,Urban,English,Bachelor,9145,465,Mobile + Desktop,2.0,1.1,0.145,0.099,171,100k+,"Gardening, Investing and Finance, Music Production"
893,55-64,Male,Urban,Mandarin,Technical,3832,273,Desktop Only,2.2,2.7,0.043,0.074,50,40k-60k,Fitness and Wellness
894,25-34,Male,Rural,Spanish,High School,2383,106,Mobile Only,1.6,6.7,0.065,0.074,142,20k-40k,"Software Engineering, Fitness and Wellness, Fashion Modelling"
895,45-54,Female,Suburban,English,High School,9621,126,Tablet,4.7,2.5,0.124,0.025,36,60k-80k,"Gaming, Software Engineering"
896,25-34,Female,Suburban,English,PhD,8769,208,Mobile + Desktop,2.8,2.7,0.105,0.083,101,0-20k,"Gaming, Investing and Finance, Pet Care, Music Production"
897,25-34,Male,Suburban,Hindi,Bachelor,7098,329,Mobile + Desktop,0.6,1.9,0.195,0.041,168,0-20k,"Eco-Friendly Living, Gourmet Cooking, Fitness and Wellness, Software Engineering"
898,55-64,Male,Urban,Spanish,Master,5513,495,Mobile + Desktop,0.6,6.0,0.184,0.096,160,60k-80k,"Fitness and Wellness, Photography, Fashion Modelling"
899,18-24,Female,Suburban,Spanish,Technical,1369,30,Mobile + Desktop,4.9,1.5,0.144,0.008,148,40k-60k,Fitness and Wellness
900,18-24,Male,Urban,Spanish,Bachelor,7968,209,Mobile + Desktop,1.5,3.3,0.206,0.044,20,20k-40k,"Gardening, DIY Crafts, Data Science, Investing and Finance"
901,25-34,Female,Urban,Hindi,Technical,2703,380,Mobile Only,4.1,3.0,0.141,0.056,22,100k+,"Fitness and Wellness, Pet Care"
902,18-24,Male,Suburban,Hindi,High School,6061,456,Tablet,0.8,4.9,0.241,0.041,140,20k-40k,"Gardening, Eco-Friendly Living, Music Production"
903,25-34,Female,Suburban,Hindi,PhD,9761,350,Mobile + Desktop,4.6,6.1,0.054,0.021,79,60k-80k,Photography
904,35-44,Male,Rural,Hindi,PhD,8669,457,Tablet,4.4,4.7,0.179,0.059,5,60k-80k,Reading and Literature
905,35-44,Male,Rural,Hindi,Master,7657,257,Desktop Only,3.1,7.5,0.092,0.076,129,100k+,"Music Production, Fitness and Wellness"
906,55-64,Male,Suburban,Mandarin,PhD,1780,285,Mobile + Desktop,0.5,7.7,0.07,0.064,42,20k-40k,"Eco-Friendly Living, Travel and Adventure, Digital Marketing"
907,55-64,Female,Urban,Mandarin,High School,8533,273,Mobile + Desktop,1.7,3.5,0.045,0.023,49,0-20k,"Pet Care, Music Production, Data Science"
908,25-34,Female,Urban,Spanish,Master,9211,67,Tablet,2.3,6.4,0.138,0.073,85,20k-40k,"Gardening, Gaming, Digital Marketing, Photography"
909,25-34,Female,Urban,English,Bachelor,5782,311,Mobile + Desktop,2.6,6.2,0.054,0.026,133,40k-60k,Gourmet Cooking
910,25-34,Female,Urban,Spanish,PhD,8184,40,Mobile + Desktop,1.8,7.3,0.05,0.018,36,20k-40k,Pet Care
911,35-44,Male,Urban,English,Master,5467,258,Mobile + Desktop,0.6,4.1,0.248,0.069,140,100k+,"Eco-Friendly Living, Reading and Literature, Music Production"
912,25-34,Female,Rural,Hindi,High School,169,102,Mobile Only,3.2,4.7,0.2,0.084,122,60k-80k,"Gaming, DIY Crafts, Gardening, Eco-Friendly Living"
913,45-54,Female,Suburban,English,Technical,4024,274,Mobile Only,2.9,3.9,0.187,0.048,44,60k-80k,"Gourmet Cooking, Gaming, Fashion Modelling, DIY Crafts"
914,35-44,Male,Rural,Spanish,Technical,6300,280,Mobile + Desktop,1.8,7.0,0.199,0.053,78,20k-40k,"Investing and Finance, Music Production, Fitness and Wellness, Fashion Modelling"
915,35-44,Male,Urban,Spanish,High School,2107,103,Mobile Only,0.7,2.6,0.242,0.03,115,80k-100k,"DIY Crafts, Gourmet Cooking, Fitness and Wellness"
916,35-44,Male,Urban,English,High School,9092,163,Desktop Only,5.0,2.7,0.143,0.049,107,60k-80k,"Music Production, Fashion Modelling, Pet Care, Photography"
917,25-34,Female,Urban,Mandarin,Technical,8219,403,Mobile + Desktop,2.7,3.6,0.055,0.013,107,40k-60k,"Gourmet Cooking, Investing and Finance, Fashion Modelling"
918,55-64,Male,Urban,Hindi,Master,2879,294,Desktop Only,3.9,2.6,0.216,0.096,78,0-20k,"Investing and Finance, Gourmet Cooking, Fashion Modelling"
919,45-54,Male,Suburban,Hindi,Technical,5020,89,Tablet,2.5,4.9,0.186,0.08,168,0-20k,"Pet Care, Photography, Gaming, Data Science"
920,18-24,Male,Urban,Spanish,High School,855,301,Desktop Only,0.7,1.9,0.104,0.067,118,80k-100k,"Reading and Literature, Travel and Adventure"
921,55-64,Male,Suburban,Mandarin,PhD,6595,93,Tablet,1.9,3.2,0.118,0.054,127,20k-40k,"Digital Marketing, Travel and Adventure"
922,35-44,Male,Urban,English,Bachelor,6035,374,Mobile + Desktop,1.9,7.4,0.103,0.079,61,80k-100k,"Investing and Finance, DIY Crafts"
923,55-64,Female,Suburban,Hindi,PhD,9613,383,Tablet,4.3,3.9,0.232,0.049,78,40k-60k,"Eco-Friendly Living, Photography, Music Production"
924,45-54,Male,Rural,Mandarin,PhD,2430,46,Tablet,3.4,6.2,0.086,0.03,87,80k-100k,DIY Crafts
925,35-44,Male,Urban,Hindi,High School,5805,351,Desktop Only,1.7,1.8,0.241,0.016,177,80k-100k,"Digital Marketing, Reading and Literature, Investing and Finance, Software Engineering"
926,18-24,Female,Suburban,Mandarin,Technical,8401,336,Desktop Only,4.9,2.7,0.228,0.065,83,100k+,"Data Science, DIY Crafts"
927,25-34,Female,Rural,Mandarin,Master,1116,416,Desktop Only,1.9,6.7,0.158,0.093,134,40k-60k,"Pet Care, Gardening, Music Production, Software Engineering"
928,35-44,Male,Urban,Spanish,PhD,7447,434,Mobile + Desktop,5.0,6.3,0.145,0.015,97,0-20k,"Software Engineering, Reading and Literature, Fashion Modelling, DIY Crafts"
929,45-54,Female,Urban,Hindi,Technical,8316,241,Mobile + Desktop,5.0,3.7,0.093,0.018,54,40k-60k,"Gardening, Photography, Eco-Friendly Living, Pet Care"
930,25-34,Female,Urban,English,Master,5038,102,Desktop Only,1.4,7.7,0.005,0.043,33,20k-40k,"Gardening, Eco-Friendly Living"
931,18-24,Female,Suburban,Spanish,PhD,2938,345,Mobile + Desktop,1.9,7.4,0.032,0.081,85,100k+,"DIY Crafts, Photography, Eco-Friendly Living, Data Science"
932,55-64,Male,Suburban,Spanish,Master,837,111,Mobile + Desktop,2.7,7.7,0.189,0.029,14,100k+,"Digital Marketing, Reading and Literature"
933,65+,Female,Rural,English,Technical,6300,421,Tablet,3.5,4.0,0.118,0.025,159,100k+,Gourmet Cooking
934,35-44,Female,Suburban,Spanish,Bachelor,8471,441,Tablet,2.9,2.4,0.037,0.062,121,100k+,"Music Production, Gaming, Fitness and Wellness"
935,25-34,Male,Suburban,Mandarin,Technical,331,175,Desktop Only,4.9,5.4,0.066,0.054,147,100k+,"Software Engineering, Digital Marketing"
936,25-34,Female,Urban,Mandarin,High School,2017,168,Mobile + Desktop,3.8,5.8,0.237,0.006,64,0-20k,"Gardening, Data Science"
937,18-24,Female,Urban,Hindi,Master,8634,23,Tablet,1.5,1.9,0.092,0.008,163,20k-40k,"Eco-Friendly Living, Software Engineering"
938,55-64,Male,Urban,Hindi,Bachelor,6018,382,Mobile Only,1.0,6.5,0.227,0.064,153,100k+,"Investing and Finance, Music Production"
939,18-24,Female,Urban,English,Master,2723,234,Mobile + Desktop,3.6,1.1,0.076,0.047,64,40k-60k,"Reading and Literature, Gaming"
940,35-44,Female,Urban,Hindi,Master,8746,82,Mobile Only,1.2,4.4,0.136,0.097,62,40k-60k,"Gourmet Cooking, Photography, Eco-Friendly Living"
941,25-34,Female,Urban,Mandarin,PhD,6501,258,Desktop Only,4.0,3.3,0.005,0.068,173,100k+,"Gardening, Fitness and Wellness"
942,35-44,Female,Urban,English,High School,7172,100,Mobile + Desktop,1.9,6.2,0.13,0.001,178,20k-40k,"Gardening, Pet Care, Software Engineering"
943,45-54,Male,Rural,English,Master,2376,225,Desktop Only,2.0,3.2,0.159,0.048,49,40k-60k,"DIY Crafts, Music Production, Photography, Pet Care"
944,55-64,Female,Rural,Hindi,Technical,7493,470,Desktop Only,0.5,6.8,0.059,0.041,128,60k-80k,"Data Science, Investing and Finance"
945,25-34,Female,Rural,Mandarin,Technical,8887,99,Desktop Only,3.7,5.2,0.145,0.011,30,60k-80k,Gardening
946,18-24,Female,Rural,English,PhD,3974,38,Desktop Only,1.0,6.6,0.162,0.092,106,80k-100k,Digital Marketing
947,18-24,Male,Urban,Mandarin,High School,4630,444,Desktop Only,4.0,7.9,0.172,0.081,55,40k-60k,"Data Science, Fashion Modelling, Pet Care, Gardening"
948,55-64,Female,Rural,Mandarin,High School,7264,314,Mobile + Desktop,2.7,5.8,0.194,0.023,168,60k-80k,Music Production
949,55-64,Female,Urban,Mandarin,Technical,4597,436,Mobile Only,4.0,7.9,0.078,0.026,56,60k-80k,"Fitness and Wellness, Eco-Friendly Living"
950,35-44,Male,Rural,Hindi,Bachelor,8033,485,Mobile + Desktop,3.1,1.2,0.142,0.003,55,40k-60k,"Fitness and Wellness, Gaming, Gourmet Cooking"
951,45-54,Male,Suburban,Spanish,PhD,2235,229,Mobile + Desktop,0.9,3.4,0.245,0.03,135,20k-40k,"Music Production, Pet Care, Investing and Finance"
952,45-54,Male,Rural,Spanish,PhD,6827,337,Mobile + Desktop,3.9,1.8,0.225,0.058,18,100k+,"Investing and Finance, Gourmet Cooking, Travel and Adventure, Fashion Modelling"
953,25-34,Male,Rural,English,Technical,1665,224,Tablet,0.8,2.8,0.238,0.042,5,100k+,"Gourmet Cooking, Software Engineering, Reading and Literature"
954,55-64,Female,Urban,Mandarin,Technical,408,230,Tablet,2.7,6.9,0.097,0.097,149,20k-40k,"Gaming, Investing and Finance, Music Production"
955,35-44,Female,Rural,Hindi,Bachelor,8634,398,Mobile + Desktop,1.3,1.2,0.197,0.006,18,20k-40k,"Pet Care, Gaming"
956,25-34,Male,Suburban,Mandarin,Bachelor,8727,51,Mobile Only,3.9,4.6,0.155,0.059,85,100k+,"Gaming, Gardening, Software Engineering"
957,35-44,Male,Urban,Mandarin,High School,8468,144,Mobile + Desktop,4.6,5.0,0.021,0.086,7,60k-80k,Digital Marketing
958,18-24,Male,Urban,Hindi,PhD,238,51,Desktop Only,3.0,4.9,0.206,0.048,102,40k-60k,"Travel and Adventure, Fashion Modelling, Gaming, Digital Marketing"
959,25-34,Male,Rural,Spanish,PhD,293,173,Tablet,2.9,4.3,0.169,0.0,44,80k-100k,"Travel and Adventure, Music Production, Gaming"
960,45-54,Female,Urban,Mandarin,Technical,3357,370,Tablet,3.9,6.5,0.05,0.024,93,40k-60k,Gaming
